{
  "$schema": "https://json-schema.org/draft/2020-12/schema",
  "$id": "https://github.com/djaredj/ground-truth-credential/schema/gtc-manifest-v0.1.json",
  "title": "GTC Disclosure Manifest",
  "description": "Ground Truth Credential deployer-side disclosure manifest. Each manifest accompanies a piece of AI-assisted content and declares the structural conditions under which it was produced.",
  "type": "object",
  "required": [
    "schema_version",
    "manifest_id",
    "created_at",
    "deployer",
    "content",
    "ai_system",
    "disclosures"
  ],
  "properties": {
    "schema_version": {
      "type": "string",
      "const": "0.1",
      "description": "Version of the GTC manifest schema. The visual mark is version-independent; versioning lives here."
    },
    "manifest_id": {
      "type": "string",
      "description": "Unique identifier for this manifest. Format: gtc-[content-identifier]-[YYYY-MM-DD]. Example: gtc-glasswing-014-2026-08-12."
    },
    "created_at": {
      "type": "string",
      "format": "date-time",
      "description": "ISO 8601 timestamp of manifest creation. Git commit timestamp provides independent verification."
    },
    "deployer": {
      "type": "object",
      "description": "The person or entity that produced and published the content. The deployer is the party making the disclosure, not the AI provider.",
      "required": [
        "name"
      ],
      "properties": {
        "name": {
          "type": "string",
          "description": "Legal name or professional identity of the deployer. Example: Dee Jared Johnson."
        },
        "organization": {
          "type": "string",
          "description": "Organization the deployer represents, if any. Example: Cognitive Fusion."
        },
        "url": {
          "type": "string",
          "format": "uri",
          "description": "Deployer's professional URL. Example: https://www.cognitivefusion.systems."
        },
        "role": {
          "type": "string",
          "description": "Deployer's role relevant to the content. Example: Author, Editor, Publisher."
        }
      }
    },
    "content": {
      "type": "object",
      "description": "Metadata about the content this manifest accompanies.",
      "required": [
        "title",
        "content_hash"
      ],
      "properties": {
        "title": {
          "type": "string",
          "description": "Title of the content. Example: The Glasswing Translator, Issue 014."
        },
        "type": {
          "type": "string",
          "enum": [
            "article",
            "post",
            "report",
            "image",
            "document",
            "presentation",
            "audio",
            "video",
            "pdf",
            "other"
          ],
          "description": "Content format category."
        },
        "url": {
          "type": "string",
          "format": "uri",
          "description": "Canonical URL where the content is published."
        },
        "published_at": {
          "type": "string",
          "format": "date-time",
          "description": "ISO 8601 timestamp of content publication."
        },
        "content_hash": {
          "type": "string",
          "description": "SHA-256 hash of the final published content. This is the hard binding between the manifest and the content."
        },
        "hash_method": {
          "type": "string",
          "const": "SHA-256",
          "description": "Hash algorithm used. SHA-256 is the only supported method in v0.1."
        },
        "hash_scope": {
          "type": "string",
          "description": "What was hashed. Example: full HTML of published page, raw text body excluding navigation, PDF file bytes."
        },
        "platform": {
          "type": "string",
          "description": "Social media platform where the content is published. Example: LinkedIn, X / Twitter, Instagram. Used when content.type is post."
        },
        "content_format": {
          "type": "string",
          "enum": [
            "text",
            "image",
            "both",
            "video",
            "pdf",
            "audio",
            "doc"
          ],
          "description": "The media format of the social post. Distinguishes a text-only post from an image post, mixed post, video, PDF/carousel, audio, or document when content.type is post."
        }
      }
    },
    "ai_system": {
      "type": "object",
      "description": "The AI system(s) used in producing the content.",
      "required": [
        "provider",
        "system"
      ],
      "properties": {
        "provider": {
          "type": "string",
          "description": "Company that built the AI system. Example: Anthropic."
        },
        "system": {
          "type": "string",
          "description": "Name of the AI system or model. Example: Claude."
        },
        "model_version": {
          "type": "string",
          "description": "Specific model version if known. Example: claude-sonnet-4-6."
        },
        "usage_type": {
          "type": "string",
          "enum": [
            "drafting",
            "editing",
            "research",
            "analysis",
            "translation",
            "code_generation",
            "image_generation",
            "transcription",
            "other"
          ],
          "description": "How the AI system was used in content production."
        },
        "usage_description": {
          "type": "string",
          "description": "Free-text description of AI involvement. Example: Claude drafted the prose from DJJ's structural claims and editorial direction."
        }
      }
    },
    "disclosures": {
      "type": "array",
      "minItems": 1,
      "description": "Structured conflict declarations. Each disclosure names a specific structural relationship or conflict between the deployer, the AI provider, and the content's subject matter. This is the core of GTC \u2014 the layer that provider-side provenance does not provide.",
      "items": {
        "type": "object",
        "required": [
          "type",
          "statement"
        ],
        "properties": {
          "type": {
            "type": "string",
            "enum": [
              "provider_subject_overlap",
              "financial_relationship",
              "editorial_dependency",
              "data_access_asymmetry",
              "recursive_disclosure",
              "regulatory_position",
              "competitive_interest",
              "other"
            ],
            "description": "Category of the structural conflict or relationship being disclosed."
          },
          "statement": {
            "type": "string",
            "description": "Plain-language declaration of the conflict. This should be specific and verifiable, not boilerplate. Example: The model used to produce this analysis was built by the company this analysis critiques."
          },
          "severity": {
            "type": "string",
            "enum": [
              "structural",
              "material",
              "contextual"
            ],
            "description": "Severity classification. Structural: the conflict is inherent to the production method and cannot be mitigated. Material: the conflict could influence the content's conclusions. Contextual: the relationship exists but is unlikely to influence the content."
          },
          "mitigation": {
            "type": "string",
            "description": "What the deployer did to address the conflict, if anything. Example: Structural claims are DJJ's; prose is Claude's. The conflict is named, not resolved."
          }
        }
      }
    },
    "prior_manifests": {
      "type": "array",
      "description": "References to GTC manifests for earlier content in the same publication or series. Creates a verifiable disclosure chain.",
      "items": {
        "type": "object",
        "properties": {
          "manifest_id": {
            "type": "string",
            "description": "The manifest_id of the prior manifest."
          },
          "url": {
            "type": "string",
            "format": "uri",
            "description": "URL to the prior manifest file."
          }
        }
      }
    },
    "verification": {
      "type": "object",
      "description": "How to verify this manifest.",
      "properties": {
        "manifest_url": {
          "type": "string",
          "format": "uri",
          "description": "Canonical URL of this manifest file. Example: https://github.com/djaredj/ground-truth-credential/blob/main/manifests/glasswing-014.json."
        },
        "verification_page": {
          "type": "string",
          "format": "uri",
          "description": "URL of the verification lookup page. Example: https://djaredj.github.io/ground-truth-credential/verify/."
        },
        "git_commit": {
          "type": "string",
          "description": "Git commit SHA that added or last modified this manifest. Provides independent timestamp verification."
        }
      }
    },
    "notes": {
      "type": "string",
      "description": "Optional free-text field for additional context not covered by structured fields."
    }
  }
}
