{
  "schema_version": "0.1",
  "manifest_id": "gtc-glasswing-007",
  "created_at": "2026-08-25T00:00:00Z",
  "deployer": {
    "name": "Dee Jared Johnson",
    "organization": "Cognitive Fusion",
    "url": "https://www.cognitivefusion.systems",
    "role": "Author"
  },
  "content": {
    "title": "The Glasswing Translator, Issue 007 \u2014 Edge Governance",
    "type": "article",
    "url": "https://www.cognitivefusion.systems/glasswing-007.html",
    "content_hash": "fe2b2b142ec2bc2240f9ce5859a672742ed90d608d90406e9f6c1e2bbdc3234f",
    "hash_method": "SHA-256",
    "hash_scope": "Full HTML file bytes of the published page."
  },
  "ai_system": {
    "provider": "Anthropic",
    "system": "Claude",
    "usage_type": "drafting",
    "usage_description": "Claude drafted the prose from DJJ's structural claims, editorial direction, and analytical framework. The structural claims are DJJ's. The prose is Claude's."
  },
  "disclosures": [
    {
      "type": "provider_subject_overlap",
      "statement": "This issue analyzes a US enforcement action directed at Anthropic, an executive order governing Anthropic's models, and agentic-stack disclosures affecting Anthropic's coding agent. The conflict is doubled twice over.",
      "severity": "structural",
      "mitigation": "Disclosure section explicitly names the doubled conflict."
    },
    {
      "type": "editorial_dependency",
      "statement": "Claude wrote this. Anthropic is discussed. The structural claims are DJJ's.",
      "severity": "structural",
      "mitigation": "Naming the tension does not resolve it."
    }
  ],
  "prior_manifests": [
    {
      "manifest_id": "gtc-glasswing-006",
      "url": "https://github.com/djaredj/Ground-Truth-Credential/blob/main/manifests/glasswing-006.json"
    }
  ],
  "verification": {
    "manifest_url": "https://github.com/djaredj/Ground-Truth-Credential/blob/main/manifests/glasswing-007.json",
    "verification_page": "https://djaredj.github.io/Ground-Truth-Credential/verify/",
    "git_commit": ""
  },
  "notes": "Retroactive GTC manifest for Glasswing Translator Issue 007. Generated 2026-08-25 from the published HTML file. Disclosure text extracted from the issue's own disclosure section."
}