{
  "schema_version": "0.1",
  "manifest_id": "gtc-glasswing-005",
  "created_at": "2026-08-25T00:00:00Z",
  "deployer": {
    "name": "Dee Jared Johnson",
    "organization": "Cognitive Fusion",
    "url": "https://www.cognitivefusion.systems",
    "role": "Author"
  },
  "content": {
    "title": "The Glasswing Translator, Issue 005 \u2014 The Indemnity Gap",
    "type": "article",
    "url": "https://www.cognitivefusion.systems/glasswing-005.html",
    "content_hash": "70e8622da43d0cc37624b984a2de4d4cc5886c221064c715c698fffde8af6342",
    "hash_method": "SHA-256",
    "hash_scope": "Full HTML file bytes of the published page."
  },
  "ai_system": {
    "provider": "Anthropic",
    "system": "Claude",
    "usage_type": "drafting",
    "usage_description": "Claude drafted the prose from DJJ's structural claims, editorial direction, and analytical framework. The structural claims are DJJ's. The prose is Claude's."
  },
  "disclosures": [
    {
      "type": "provider_subject_overlap",
      "statement": "Claude drafted this issue on the indemnity gap in AI deployments, a gap that applies to Anthropic's own deployment terms.",
      "severity": "structural",
      "mitigation": "Disclosure section published."
    },
    {
      "type": "editorial_dependency",
      "statement": "Claude wrote this. Anthropic is discussed. The structural claims are DJJ's.",
      "severity": "structural",
      "mitigation": "Naming the tension does not resolve it."
    }
  ],
  "prior_manifests": [
    {
      "manifest_id": "gtc-glasswing-004",
      "url": "https://github.com/djaredj/Ground-Truth-Credential/blob/main/manifests/glasswing-004.json"
    }
  ],
  "verification": {
    "manifest_url": "https://github.com/djaredj/Ground-Truth-Credential/blob/main/manifests/glasswing-005.json",
    "verification_page": "https://djaredj.github.io/Ground-Truth-Credential/verify/",
    "git_commit": ""
  },
  "notes": "Retroactive GTC manifest for Glasswing Translator Issue 005. Generated 2026-08-25 from the published HTML file. Disclosure text extracted from the issue's own disclosure section."
}