{
  "schema_version": "0.1",
  "manifest_id": "gtc-glasswing-002",
  "created_at": "2026-08-25T00:00:00Z",
  "deployer": {
    "name": "Dee Jared Johnson",
    "organization": "Cognitive Fusion",
    "url": "https://www.cognitivefusion.systems",
    "role": "Author"
  },
  "content": {
    "title": "The Glasswing Translator, Issue 002 \u2014 The Protocol That Disclaimed Itself",
    "type": "article",
    "url": "https://www.cognitivefusion.systems/glasswing-002.html",
    "content_hash": "2c127147be3c2d8a93723daf77a572e3215f64123d6201ddd49aae62ba39bbe3",
    "hash_method": "SHA-256",
    "hash_scope": "Full HTML file bytes of the published page."
  },
  "ai_system": {
    "provider": "Anthropic",
    "system": "Claude",
    "usage_type": "drafting",
    "usage_description": "Claude drafted the prose from DJJ's structural claims, editorial direction, and analytical framework. The structural claims are DJJ's. The prose is Claude's."
  },
  "disclosures": [
    {
      "type": "provider_subject_overlap",
      "statement": "Claude drafted this issue. Anthropic is discussed as a subject. The conflict is the same as Issue 001 and is stated in every issue.",
      "severity": "structural",
      "mitigation": "Disclosure section published in every issue."
    },
    {
      "type": "editorial_dependency",
      "statement": "Claude wrote this. Anthropic is discussed. The structural claims are DJJ's.",
      "severity": "structural",
      "mitigation": "Naming the tension does not resolve it."
    }
  ],
  "prior_manifests": [
    {
      "manifest_id": "gtc-glasswing-001",
      "url": "https://github.com/djaredj/Ground-Truth-Credential/blob/main/manifests/glasswing-001.json"
    }
  ],
  "verification": {
    "manifest_url": "https://github.com/djaredj/Ground-Truth-Credential/blob/main/manifests/glasswing-002.json",
    "verification_page": "https://djaredj.github.io/Ground-Truth-Credential/verify/",
    "git_commit": ""
  },
  "notes": "Retroactive GTC manifest for Glasswing Translator Issue 002. Generated 2026-08-25 from the published HTML file. Disclosure text extracted from the issue's own disclosure section."
}