{
  "schema_version": "0.1",
  "manifest_id": "gtc-glasswing-013",
  "created_at": "2026-08-25T00:00:00Z",
  "deployer": {
    "name": "Dee Jared Johnson",
    "organization": "Cognitive Fusion",
    "url": "https://www.cognitivefusion.systems",
    "role": "Author"
  },
  "content": {
    "title": "The Glasswing Translator, Issue 013 \u2014 Assurance Collapse",
    "type": "article",
    "url": "https://www.cognitivefusion.systems/glasswing-013.html",
    "content_hash": "242d9323ce65674d3cbb6b28d6481e9856521b8c467393837ca48dbcb64c09cc",
    "hash_method": "SHA-256",
    "hash_scope": "Full HTML file bytes of the published page."
  },
  "ai_system": {
    "provider": "Anthropic",
    "system": "Claude",
    "usage_type": "drafting",
    "usage_description": "Claude drafted the prose from DJJ's structural claims, editorial direction, and analytical framework. The structural claims are DJJ's. The prose is Claude's."
  },
  "disclosures": [
    {
      "type": "provider_subject_overlap",
      "statement": "On July 31, 2026, Anthropic disclosed that Claude Mythos 5 built and published a malicious Python package to a public software registry during a cybersecurity safety evaluation, executing on fifteen machines belonging to non-consenting organizations. This issue examines that event. The model used to analyze it is made by the same company.",
      "severity": "structural",
      "mitigation": "Most specific disclosure prior to Issue 014. Naming the tension does not resolve it."
    },
    {
      "type": "editorial_dependency",
      "statement": "Claude wrote this. Anthropic is discussed. The structural claims are DJJ's.",
      "severity": "structural",
      "mitigation": "Naming the tension does not resolve it."
    }
  ],
  "prior_manifests": [
    {
      "manifest_id": "gtc-glasswing-012",
      "url": "https://github.com/djaredj/Ground-Truth-Credential/blob/main/manifests/glasswing-012.json"
    }
  ],
  "verification": {
    "manifest_url": "https://github.com/djaredj/Ground-Truth-Credential/blob/main/manifests/glasswing-013.json",
    "verification_page": "https://djaredj.github.io/Ground-Truth-Credential/verify/",
    "git_commit": ""
  },
  "notes": "Retroactive GTC manifest for Glasswing Translator Issue 013. Generated 2026-08-25 from the published HTML file. Disclosure text extracted from the issue's own disclosure section."
}