{
  "schema_version": "0.1",
  "manifest_id": "gtc-glasswing-011",
  "created_at": "2026-08-25T00:00:00Z",
  "deployer": {
    "name": "Dee Jared Johnson",
    "organization": "Cognitive Fusion",
    "url": "https://www.cognitivefusion.systems",
    "role": "Author"
  },
  "content": {
    "title": "The Glasswing Translator, Issue 011 \u2014 Execution Drift",
    "type": "article",
    "url": "https://www.cognitivefusion.systems/glasswing-011.html",
    "content_hash": "e02da4217f8fcd6bd0c40ffa102bca7067e11d5891b294f38c4053697160b000",
    "hash_method": "SHA-256",
    "hash_scope": "Full HTML file bytes of the published page."
  },
  "ai_system": {
    "provider": "Anthropic",
    "system": "Claude",
    "usage_type": "drafting",
    "usage_description": "Claude drafted the prose from DJJ's structural claims, editorial direction, and analytical framework. The structural claims are DJJ's. The prose is Claude's."
  },
  "disclosures": [
    {
      "type": "provider_subject_overlap",
      "statement": "The 'Science: A New Golden Age' report references Anthropic and Claude directly \u2014 an Anthropic researcher and an AI system co-produced a mathematical result the report cites. That relationship is a conflict.",
      "severity": "structural",
      "mitigation": "Disclosed in two-part disclosure block."
    },
    {
      "type": "editorial_dependency",
      "statement": "Claude wrote this. Anthropic is both the subject of policy discussion and the tool used to produce the analysis.",
      "severity": "structural",
      "mitigation": "Naming the tension does not resolve it."
    }
  ],
  "prior_manifests": [
    {
      "manifest_id": "gtc-glasswing-010",
      "url": "https://github.com/djaredj/Ground-Truth-Credential/blob/main/manifests/glasswing-010.json"
    }
  ],
  "verification": {
    "manifest_url": "https://github.com/djaredj/Ground-Truth-Credential/blob/main/manifests/glasswing-011.json",
    "verification_page": "https://djaredj.github.io/Ground-Truth-Credential/verify/",
    "git_commit": ""
  },
  "notes": "Retroactive GTC manifest for Glasswing Translator Issue 011. Generated 2026-08-25 from the published HTML file. Disclosure text extracted from the issue's own disclosure section."
}