{
  "schema_version": "0.1",
  "manifest_id": "gtc-glasswing-010",
  "created_at": "2026-08-25T00:00:00Z",
  "deployer": {
    "name": "Dee Jared Johnson",
    "organization": "Cognitive Fusion",
    "url": "https://www.cognitivefusion.systems",
    "role": "Author"
  },
  "content": {
    "title": "The Glasswing Translator, Issue 010 \u2014 Phantom Control",
    "type": "article",
    "url": "https://www.cognitivefusion.systems/glasswing-010.html",
    "content_hash": "5ff4980c3296500ed0f3ba6ed9ea53c7d02384da63c930d83b709fead87fbf75",
    "hash_method": "SHA-256",
    "hash_scope": "Full HTML file bytes of the published page."
  },
  "ai_system": {
    "provider": "Anthropic",
    "system": "Claude",
    "usage_type": "drafting",
    "usage_description": "Claude drafted the prose from DJJ's structural claims, editorial direction, and analytical framework. The structural claims are DJJ's. The prose is Claude's."
  },
  "disclosures": [
    {
      "type": "provider_subject_overlap",
      "statement": "Anthropic is discussed in this issue as a Project Glasswing participant and as the maker of the drafting tool. The conflict is structural.",
      "severity": "structural",
      "mitigation": "No financial relationship with Anthropic. Naming the tension does not resolve it."
    },
    {
      "type": "editorial_dependency",
      "statement": "Claude wrote this. Anthropic is discussed. Naming the tension does not resolve it.",
      "severity": "structural",
      "mitigation": "Disclosed openly."
    }
  ],
  "prior_manifests": [
    {
      "manifest_id": "gtc-glasswing-009",
      "url": "https://github.com/djaredj/Ground-Truth-Credential/blob/main/manifests/glasswing-009.json"
    }
  ],
  "verification": {
    "manifest_url": "https://github.com/djaredj/Ground-Truth-Credential/blob/main/manifests/glasswing-010.json",
    "verification_page": "https://djaredj.github.io/Ground-Truth-Credential/verify/",
    "git_commit": ""
  },
  "notes": "Retroactive GTC manifest for Glasswing Translator Issue 010. Generated 2026-08-25 from the published HTML file. Disclosure text extracted from the issue's own disclosure section."
}